{
  "$schema": "../v2/live-run.schema.json",
  "record_version": 1,
  "id": "chromium-native-live-run.v1",
  "recorded_at": "2026-08-30T10:33:09.159Z",
  "repository": {
    "base_commit": "068db9fe389fd7777bd903021b9c2baf3bde5140",
    "working_tree_dirty": false
  },
  "environment": {
    "os": "Omarchy",
    "kernel": "Linux 7.1.9-arch1-2",
    "chromium": "Chromium 151.0.7922.173 Arch Linux",
    "playwright": "1.62.1",
    "rustc": "rustc 1.98.0 (88d9e12ae 2026-08-18)",
    "cargo": "cargo 1.98.0 (797e8a9bc 2026-08-05)",
    "node": "v26.8.1",
    "npm": "11.19.0"
  },
  "extension": {
    "id": "ckkiehcjbclcjckkkajohopoikeejkoa",
    "manifest_version": 3,
    "minimum_chrome_version": "132",
    "incognito": "not_allowed",
    "permission_mode": "static-exact-port",
    "api_permissions": [
      "nativeMessaging"
    ],
    "manifest_keys": [
      "background",
      "commands",
      "content_scripts",
      "description",
      "incognito",
      "key",
      "manifest_version",
      "minimum_chrome_version",
      "name",
      "permissions",
      "version"
    ],
    "host_match": "http://localhost:4173/chromium.html",
    "content_script": {
      "matches": [
        "http://localhost:4173/chromium.html"
      ],
      "js": [
        "content-script.js"
      ],
      "run_at": "document_idle",
      "all_frames": false,
      "match_about_blank_present": false,
      "match_origin_as_fallback_present": false
    },
    "runtime_url": "http://localhost:4173/chromium.html"
  },
  "native": {
    "host_name": "io.github.ahuray.badi",
    "caller_origin": "chrome-extension://ckkiehcjbclcjckkkajohopoikeejkoa/",
    "max_envelope_bytes": 65536,
    "socket_parent_mode": "0700",
    "socket_mode": "0600",
    "peer_uid_verified": true
  },
  "isolation": {
    "temporary_home": true,
    "temporary_xdg_runtime": true,
    "temporary_profile": true,
    "real_profile_touched": false,
    "user_config_touched": false,
    "system_manifest_touched": false,
    "temporary_tree_removed": true,
    "socket_removed": true,
    "processes_remaining": 0
  },
  "privacy": {
    "context_text_recorded": false,
    "suggestion_text_recorded": false,
    "context_fingerprints_recorded": false,
    "absolute_personal_paths_recorded": false
  },
  "commands": [
    {
      "id": "cargo-build-bins",
      "command": "cargo build --workspace --bins",
      "exit_code": 0
    },
    {
      "id": "cargo-test-workspace",
      "command": "cargo test --workspace",
      "exit_code": 0
    },
    {
      "id": "chromium-typecheck",
      "command": "npm run typecheck --workspace @badi/chromium",
      "exit_code": 0
    },
    {
      "id": "chromium-unit",
      "command": "npm test --workspace @badi/chromium",
      "exit_code": 0
    },
    {
      "id": "chromium-build-verify",
      "command": "npm run build:verify --workspace @badi/chromium",
      "exit_code": 0
    },
    {
      "id": "isolated-live-run",
      "command": "node adapters/chromium/live/run-live.mjs (isolated $TEMP HOME/XDG/profile; system Chromium; generated host manifest; Rust broker/native host)",
      "exit_code": 0
    }
  ],
  "scenarios": [
    {
      "id": "chromium.full-chain",
      "evidence_class": "real-rust-chain",
      "trials": 1,
      "passed": 1,
      "status": "pass",
      "detail": "System Chromium loaded the unpacked worker and received a visible result through the Rust native host, private UDS, broker, and deterministic provider."
    },
    {
      "id": "interaction.dismiss",
      "evidence_class": "real-rust-chain",
      "trials": 1,
      "passed": 1,
      "status": "pass",
      "detail": "A trusted Escape gesture hid the visible extension-owned UI without mutating the field."
    },
    {
      "id": "interaction.undo",
      "evidence_class": "real-rust-chain",
      "trials": 1,
      "passed": 0,
      "status": "unsupported",
      "detail": "The vanilla setRangeText plus dispatched input path did not create a Chromium undo transaction."
    },
    {
      "id": "commit.accept-word",
      "evidence_class": "real-rust-chain",
      "trials": 1,
      "passed": 1,
      "status": "pass",
      "detail": "A trusted Ctrl-ArrowRight gesture inserted only the broker-authorized first word-part."
    },
    {
      "id": "security.untrusted-keyboard",
      "evidence_class": "real-rust-chain",
      "trials": 3,
      "passed": 3,
      "status": "pass",
      "detail": "Page-authored untrusted accept-word, accept-all, and dismiss events caused no authorization or mutation; trusted automation remained functional."
    },
    {
      "id": "security.synthetic-focus-zero",
      "evidence_class": "real-rust-chain",
      "trials": 1,
      "passed": 1,
      "status": "pass",
      "detail": "Synthetic focusin and input on an unfocused eligible field produced zero broker context updates and provider calls."
    },
    {
      "id": "privacy.denied-zero",
      "evidence_class": "real-rust-chain",
      "trials": 2,
      "passed": 2,
      "status": "pass",
      "detail": "Password and one-time-code fields caused zero context, provider-call, and provider-input-byte deltas."
    },
    {
      "id": "lifecycle.dynamic-invalidation",
      "evidence_class": "real-rust-chain",
      "trials": 3,
      "passed": 3,
      "status": "pass",
      "detail": "Readonly, ancestor opt-out, and DOM replacement each hid UI and prevented later insertion."
    },
    {
      "id": "lifecycle.composition",
      "evidence_class": "real-rust-chain",
      "trials": 1,
      "passed": 1,
      "status": "pass",
      "detail": "A synthetic CompositionEvent lifecycle stimulus in real Chromium hid the result and blocked a trusted acceptance gesture until refocus/composition end."
    },
    {
      "id": "geometry.scroll-zoom",
      "evidence_class": "real-rust-chain",
      "trials": 3,
      "passed": 3,
      "status": "pass",
      "detail": "The extension-owned host remained anchored before scroll, after scroll, and after controlled page zoom plus resize."
    },
    {
      "id": "lifecycle.visibility",
      "evidence_class": "real-rust-chain",
      "trials": 1,
      "passed": 0,
      "status": "unsupported",
      "detail": "This headless build did not expose tab-background visibility transitions."
    },
    {
      "id": "lifecycle.navigation",
      "evidence_class": "real-rust-chain",
      "trials": 2,
      "passed": 2,
      "status": "pass",
      "detail": "Navigation removed the old document UI, and the exact fixture document received a fresh isolated content lifecycle on return."
    },
    {
      "id": "control.pause-authoritative",
      "evidence_class": "real-rust-chain",
      "trials": 3,
      "passed": 3,
      "status": "pass",
      "detail": "Broker-authoritative pause cleared visible UI, blocked provider work for a later edit, and resume permitted a fresh real-chain result."
    },
    {
      "id": "control.pause-shortcut",
      "evidence_class": "real-rust-chain",
      "trials": 1,
      "passed": 0,
      "status": "unsupported",
      "detail": "Chromium headless did not deliver the extension command accelerator."
    },
    {
      "id": "commit.insertion-100",
      "evidence_class": "real-rust-chain",
      "trials": 1000,
      "passed": 1000,
      "status": "pass",
      "detail": "Real Chromium verified exact value, UTF-16 caret, and one input event across end, mid-line, astral, Greek, and combining-boundary cases."
    },
    {
      "id": "latency.edit-to-visible",
      "evidence_class": "real-rust-chain",
      "trials": 1000,
      "passed": 1000,
      "status": "pass",
      "detail": "Deterministic edit-to-visible p95 stayed within the provisional 500 ms warm interaction ceiling."
    },
    {
      "id": "lifecycle.disconnect",
      "evidence_class": "real-rust-chain",
      "trials": 1,
      "passed": 1,
      "status": "pass",
      "detail": "Terminating the tracked shipped Rust native-host process propagated through the worker's frozen document route; UI cleared under the sub-TTL deadline with no insertion."
    },
    {
      "id": "race.stale-100",
      "evidence_class": "live-browser-fault-host",
      "trials": 100,
      "passed": 100,
      "status": "pass",
      "detail": "A separately labeled fault host returned every delayed response after supersession; none of the stale results displayed or inserted, and only the latest remained eligible."
    }
  ],
  "measurements": [
    {
      "name": "accept-to-insert",
      "evidence_class": "real-rust-chain",
      "unit": "milliseconds",
      "samples": 1000,
      "warmups": 50,
      "statistic": "nearest-rank-p95",
      "p95": 12.6,
      "maximum": 14.5,
      "threshold": 30,
      "status": "pass"
    },
    {
      "name": "invalidation-to-hide",
      "evidence_class": "real-rust-chain",
      "unit": "milliseconds",
      "samples": 1000,
      "warmups": 50,
      "statistic": "nearest-rank-p95",
      "p95": 0.6,
      "maximum": 0.9,
      "threshold": 32,
      "status": "pass"
    }
  ],
  "artifacts": [
    {
      "id": "broker-binary",
      "bytes": 31134544,
      "sha256": "633ee7bcf779a3e70643e3fe5a93f4e4ea55ea34349c914c5134c82388a6a149"
    },
    {
      "id": "native-host-binary",
      "bytes": 28876896,
      "sha256": "a6f63c4b6fda3cecf6ae1defdb22cc588357d88b0b64f9d197aa3cfcd56fe2aa"
    },
    {
      "id": "native-host-manifest",
      "bytes": 267,
      "sha256": "e90e86fea6e19ea166fd3f889b3987398833306de4013ef5d58b21d47c5ea1df"
    },
    {
      "id": "extension-content-script",
      "bytes": 49565,
      "sha256": "d6000980d1eb660a7f027d6f7979550ae1011c89c4064e7c857e56c4de8bb2d6"
    },
    {
      "id": "extension-service-worker",
      "bytes": 32988,
      "sha256": "ff57aec9131edad01e2faffcb2c5972b5d9c70b66caf47d4f1f552737164657c"
    },
    {
      "id": "extension-manifest",
      "bytes": 1193,